{
  "acceptance_refs": [
    "AC-003"
  ],
  "environment": "OS=Linux-5.14.0-687.36.1.el9_8.x86_64-x86_64-with-glibc2.34; Python=3.12.14",
  "evidence_refs": [],
  "execution_status": "executed",
  "id": "EV-076",
  "input_fingerprints": {
    "docs/INSTALLATION.md": "69878f47f3448ea87c7d89cb4976186c6f55dc07a31ddfe41e4900b18f9be448",
    "pyproject.toml": "e8d91c1f1ada6a4a1ed28703a0e713db90d5ef4e7f6f3d4b9eb9f75971dc6024",
    "specs/001-piloto-real-confiavel/plan.md": "a069d7b1d149ba604d47c2cb8035b6bfe0e9dc7471acd4eb697cbcab209ab66e",
    "specs/001-piloto-real-confiavel/spec.md": "057aed7c1e1360d8f71167caca6af45c61c0ddf7114ce1d2eb8ce7d6dd5858ba",
    "tests/test_service.py": "fd8eb1d8c910ad962caf2de4bc1cc9fe5bb5f758ba6a84334a74c78f00652a71"
  },
  "input_paths": [
    "pyproject.toml",
    "docs/INSTALLATION.md",
    "tests/test_service.py",
    "specs/001-piloto-real-confiavel/spec.md",
    "specs/001-piloto-real-confiavel/plan.md"
  ],
  "limitations": "CI run needs a push, which the goal explicitly prohibits. Evidence invalidated because an input changed.",
  "observations": "Python 3.10.21 rejects >=3.11; Python 3.11.16 and 3.14.7 each pass 208 tests; source and wheel build; twine check both pass. GitHub Actions workflow was not executed.",
  "procedure": "/tmp/vendedor-py310/bin/python -m pip install --dry-run --no-deps .; /tmp/vendedor-py311/bin/python -m pytest -q; /tmp/vendedor-py314/bin/python -m pytest -q; .venv/bin/python -m build; .venv/bin/twine check dist/*",
  "result": "stale",
  "tested_revision": "local:f205fa6b660cca1c1c73788c51643a7e49a9f34a4d789f1a939c5305e12c57b3",
  "ticket": "TK-002",
  "timestamp": "2026-09-28T16:25:27+00:00"
}
