{
  "acceptance_refs": [
    "AC-037"
  ],
  "environment": "OS=Linux-5.14.0-687.36.1.el9_8.x86_64-x86_64-with-glibc2.34; Python=3.12.14",
  "evidence_refs": [],
  "execution_status": "executed",
  "id": "EV-069",
  "input_fingerprints": {
    "evaluation/dev.json": "bb87a690a8e602f5e2ba0a00c37cde1e06fb9a4371f07117d9091f7900f7b7cb",
    "evaluation/holdout.json": "f06fd6b9f309749f524c61b4bdd335d5e8cabdb0b7305dbcd84b416748d417d0",
    "evaluation/thresholds.json": "fa7896eeb940108854da1f2bed46a99cf64f4245bcf623b36b356f6f6c999e2b",
    "specs/001-piloto-real-confiavel/plan.md": "a069d7b1d149ba604d47c2cb8035b6bfe0e9dc7471acd4eb697cbcab209ab66e",
    "specs/001-piloto-real-confiavel/spec.md": "057aed7c1e1360d8f71167caca6af45c61c0ddf7114ce1d2eb8ce7d6dd5858ba",
    "src/sales_agent/cli.py": "c26674f6a0c901905ea52cf234214f1ab8398a6bc0623c49cb176f8ed3a720d8",
    "src/sales_agent/evaluation.py": "cb6da9f5ccde250697986574d6fb361914129b7430f456648823d26407b48725",
    "tests/test_cli_and_evaluation.py": "ecea0429074aaebf8d7b7fbd8eff7adaf2b73f7624dbcfebc4db32019fe263c3"
  },
  "input_paths": [
    "src/sales_agent/evaluation.py",
    "src/sales_agent/cli.py",
    "tests/test_cli_and_evaluation.py",
    "evaluation/dev.json",
    "evaluation/holdout.json",
    "evaluation/thresholds.json",
    "specs/001-piloto-real-confiavel/spec.md",
    "specs/001-piloto-real-confiavel/plan.md"
  ],
  "limitations": "Evidence invalidated because an input changed.",
  "observations": "Fake model failed one critical repetition: case pass@1=3/4, pass^4=0/1 and thresholds_met=false.",
  "procedure": "python3.12 -m pytest -q",
  "result": "stale",
  "tested_revision": "local:ec7333c175291bca3b58039ae9282528fce02315d35f4d3331c5c46a0146187d",
  "ticket": "TK-012",
  "timestamp": "2026-09-28T16:14:12+00:00"
}
