{
  "acceptance_refs": [
    "AC-019"
  ],
  "environment": "OS=Linux-5.14.0-687.36.1.el9_8.x86_64-x86_64-with-glibc2.34; Python=3.12.14",
  "evidence_refs": [],
  "execution_status": "executed",
  "id": "EV-070",
  "input_fingerprints": {
    "specs/001-piloto-real-confiavel/plan.md": "a069d7b1d149ba604d47c2cb8035b6bfe0e9dc7471acd4eb697cbcab209ab66e",
    "specs/001-piloto-real-confiavel/spec.md": "057aed7c1e1360d8f71167caca6af45c61c0ddf7114ce1d2eb8ce7d6dd5858ba",
    "src/sales_agent/cli.py": "c26674f6a0c901905ea52cf234214f1ab8398a6bc0623c49cb176f8ed3a720d8",
    "src/sales_agent/conversation.py": "1c5c88588cdd1e07f89e7dfed202834d259f9beffadc5cb81d97ba1eb81151ae",
    "src/sales_agent/model.py": "9915f54824aa259ab36377ad71e8cc2dbc3f71d766c039df521edf0036d16b4f",
    "tests/test_model_adapter.py": "1a85545fa8a2f718410c0ebc641693cc3537c0fb411c74484fc164e9eaf5a09c"
  },
  "input_paths": [
    "src/sales_agent/model.py",
    "src/sales_agent/conversation.py",
    "src/sales_agent/cli.py",
    "tests/test_model_adapter.py",
    "specs/001-piloto-real-confiavel/spec.md",
    "specs/001-piloto-real-confiavel/plan.md"
  ],
  "limitations": "",
  "observations": "HTTP fake confirms separate system/user roles and strict json_schema request; 23 model adapter tests passed.",
  "procedure": ".venv/bin/python -m pytest -q tests/test_model_adapter.py",
  "result": "passed",
  "tested_revision": "local:a6491f0180742c07abf7912f03fe38aefba0ba0703936097a9b5a06e9ae610e6",
  "ticket": "TK-008",
  "timestamp": "2026-09-28T16:14:26+00:00"
}
