{
  "acceptance_refs": [
    "AC-002"
  ],
  "environment": "OS=Linux-5.14.0-687.36.1.el9_8.x86_64-x86_64-with-glibc2.34; Python=3.12.14",
  "evidence_refs": [],
  "execution_status": "executed",
  "id": "EV-002",
  "input_fingerprints": {
    "pyproject.toml": "a600b7af2099bc2f8359868c93fa335d6bf25f69cee6348fb17a43951f7e090b",
    "specs/001-piloto-real-confiavel/plan.md": "a069d7b1d149ba604d47c2cb8035b6bfe0e9dc7471acd4eb697cbcab209ab66e",
    "specs/001-piloto-real-confiavel/spec.md": "057aed7c1e1360d8f71167caca6af45c61c0ddf7114ce1d2eb8ce7d6dd5858ba",
    "tests/conftest.py": "0f8fcccb0a906eb3e8af46bf9b67f2e203e7fb40fb19e491974460fdccf9a6ca"
  },
  "input_paths": [
    "tests/conftest.py",
    "pyproject.toml",
    "specs/001-piloto-real-confiavel/spec.md",
    "specs/001-piloto-real-confiavel/plan.md"
  ],
  "limitations": "",
  "observations": "Normal and +400-day process clock suites: 172 passed each; Ruff all checks passed; CI job changed at parent .github/workflows/sales-agent-ci.yml",
  "procedure": ".venv/bin/python -m pytest -q && .venv/bin/python -m pytest -q --clock-shift-days=400 && .venv/bin/ruff check src tests",
  "result": "passed",
  "tested_revision": "local:edbf5cb446eecda310a1194e679af0c10785c4edbaa13bb8b3c668e6f717d820",
  "ticket": "TK-001",
  "timestamp": "2026-09-28T14:13:52+00:00"
}
