{
  "acceptance_refs": [
    "AC-010",
    "AC-011",
    "AC-012"
  ],
  "environment": "OS=Linux-5.14.0-687.36.1.el9_8.x86_64-x86_64-with-glibc2.34; Python=3.12.14",
  "evidence_refs": [],
  "execution_status": "executed",
  "id": "EV-084",
  "input_fingerprints": {
    "specs/001-piloto-real-confiavel/plan.md": "a069d7b1d149ba604d47c2cb8035b6bfe0e9dc7471acd4eb697cbcab209ab66e",
    "specs/001-piloto-real-confiavel/spec.md": "057aed7c1e1360d8f71167caca6af45c61c0ddf7114ce1d2eb8ce7d6dd5858ba",
    "src/sales_agent/service.py": "3c74beed977722d9c5df1ff5a515f068cb5a4615f54f4d8f12ba70ff0fec1f3e",
    "tests/test_service.py": "b666d97f0a001bc28f50eaceefe5beabe1b33b81aea53a8bec14dc234e5a91ea"
  },
  "input_paths": [
    "src/sales_agent/service.py",
    "tests/test_service.py",
    "specs/001-piloto-real-confiavel/spec.md",
    "specs/001-piloto-real-confiavel/plan.md"
  ],
  "limitations": "",
  "observations": "Five local service contract tests passed including ACK, readiness, and SIGTERM recovery.",
  "procedure": ".venv/bin/python -m pytest -q tests/test_service.py",
  "result": "passed",
  "tested_revision": "local:e9dc077544525d5eb0202f9ff5ddc22e06966d1b1ca94f7190b4ff891fe02524",
  "ticket": "TK-005",
  "timestamp": "2026-09-28T16:37:42+00:00"
}
