{
  "acceptance_refs": [
    "AC-024"
  ],
  "environment": "OS=Linux-5.14.0-687.36.1.el9_8.x86_64-x86_64-with-glibc2.34; Python=3.12.14",
  "evidence_refs": [],
  "execution_status": "executed",
  "id": "EV-086",
  "input_fingerprints": {
    "specs/001-piloto-real-confiavel/plan.md": "a069d7b1d149ba604d47c2cb8035b6bfe0e9dc7471acd4eb697cbcab209ab66e",
    "specs/001-piloto-real-confiavel/spec.md": "057aed7c1e1360d8f71167caca6af45c61c0ddf7114ce1d2eb8ce7d6dd5858ba",
    "src/sales_agent/conversation.py": "911132324004eadbc2c4721d11e608d89c962b657e9adafc95c9f513d26a897b",
    "src/sales_agent/drafting.py": "8974b3daa79b3f633cb787ffb466fd9395aa8634e0c8636a0492aea8fb8a34b4",
    "src/sales_agent/governance.py": "a00ebbf07a19fe8a7bbf72bf1c87bc637d25d518207890b05a2ae7489eb2bf9a",
    "src/sales_agent/model.py": "e6b453ebdf45c4a491662f6668e56e1a220dba7fb05e487638a738e93407d9e2",
    "tests/test_grounded_drafting.py": "1680cd6604043caab6b352134e3a99299b860c36c5fae6b54bea0139f41a53cc"
  },
  "input_paths": [
    "src/sales_agent/drafting.py",
    "src/sales_agent/conversation.py",
    "src/sales_agent/model.py",
    "src/sales_agent/governance.py",
    "tests/test_grounded_drafting.py",
    "specs/001-piloto-real-confiavel/spec.md",
    "specs/001-piloto-real-confiavel/plan.md"
  ],
  "limitations": "",
  "observations": "Quoted R$79.90 natural draft was delivered; test_supported_natural_draft_reaches_buyer passed.",
  "procedure": "python3.12 -m pytest -q tests/test_grounded_drafting.py tests/test_channel_pilot_supervisor.py",
  "result": "passed",
  "tested_revision": "local:af793e0042976c31d60cef4ac3ef84a9688b8f8313394e0c3c16947ada8cec27",
  "ticket": "TK-009",
  "timestamp": "2026-09-28T17:15:41+00:00"
}
