{
  "acceptance_refs": [
    "AC-023"
  ],
  "environment": "OS=Linux-5.14.0-687.36.1.el9_8.x86_64-x86_64-with-glibc2.34; Python=3.9.25",
  "evidence_refs": [],
  "execution_status": "executed",
  "id": "EV-050",
  "input_fingerprints": {
    "specs/001-piloto-real-confiavel/plan.md": "a069d7b1d149ba604d47c2cb8035b6bfe0e9dc7471acd4eb697cbcab209ab66e",
    "specs/001-piloto-real-confiavel/spec.md": "057aed7c1e1360d8f71167caca6af45c61c0ddf7114ce1d2eb8ce7d6dd5858ba",
    "src/sales_agent/cli.py": "52f324b716564757fa959bf60a2d9a601b3eacfbeff3740dcd92bbd4ff091ead",
    "src/sales_agent/conversation.py": "c69c6d86a49628104d326387d3eb49a7fe6a52797b558c9dc03ce451e88e41a8",
    "src/sales_agent/model.py": "7d787e1401ca6b5b08c5e05d512df4a7abe69fa643cb0d58fc161199ec3d9309",
    "tests/test_model_adapter.py": "2f2c29dd9cea1b50b56e25fad302b7d91b81f682fff8f9a76ede11ad5987d6ea"
  },
  "input_paths": [
    "src/sales_agent/model.py",
    "src/sales_agent/conversation.py",
    "src/sales_agent/cli.py",
    "tests/test_model_adapter.py",
    "specs/001-piloto-real-confiavel/spec.md",
    "specs/001-piloto-real-confiavel/plan.md"
  ],
  "limitations": "OpenAI real API not called; local fake HTTP contract only Evidence invalidated because an input changed.",
  "observations": "Local response contract passed in openai and openai-compatible profiles; profile and model identity were reported. Real credential call not run.",
  "procedure": ".venv/bin/python -m pytest -q tests/test_model_adapter.py",
  "result": "stale",
  "tested_revision": "local:7f62754b8c7cbf992cce862665de816bd7236024279d081fa21e403bfe3cbb9d",
  "ticket": "TK-008",
  "timestamp": "2026-09-28T15:46:18+00:00"
}
