{
  "acceptance_refs": [
    "AC-048"
  ],
  "environment": "OS=Linux-5.14.0-687.36.1.el9_8.x86_64-x86_64-with-glibc2.34; Python=3.12.14",
  "evidence_refs": [],
  "execution_status": "executed",
  "id": "EV-114",
  "input_fingerprints": {
    "specs/001-piloto-real-confiavel/plan.md": "a069d7b1d149ba604d47c2cb8035b6bfe0e9dc7471acd4eb697cbcab209ab66e",
    "specs/001-piloto-real-confiavel/spec.md": "057aed7c1e1360d8f71167caca6af45c61c0ddf7114ce1d2eb8ce7d6dd5858ba",
    "src/sales_agent/privacy.py": "67abcac346fefc0854c0b520d86753799d8352440db0e0f3864e9345f4761411",
    "src/sales_agent/storage.py": "635f4c05071be2eb78d13c4a9d384c57e4a89f7e8fcb8a9a1d8d6da3ba95084c",
    "tests/test_privacy.py": "ef7f498a2c3642a507056a1f349a6abb7f41fd67361e08e0f571fab2a08a4846"
  },
  "input_paths": [
    "src/sales_agent/privacy.py",
    "src/sales_agent/storage.py",
    "tests/test_privacy.py",
    "specs/001-piloto-real-confiavel/spec.md",
    "specs/001-piloto-real-confiavel/plan.md"
  ],
  "limitations": "",
  "observations": "4 privacy tests passed; full regression 237 passed; Ruff passed",
  "procedure": "python3.12 -m pytest -q tests/test_privacy.py",
  "result": "passed",
  "tested_revision": "local:6d2040a124bd61b746a4125b137aa55cca8baaa100ba7e4ee47784cab62d7bb3",
  "ticket": "TK-014",
  "timestamp": "2026-09-28T18:24:52+00:00"
}
