{
  "acceptance_refs": [
    "AC-047"
  ],
  "environment": "OS=Linux-5.14.0-687.36.1.el9_8.x86_64-x86_64-with-glibc2.34; Python=3.12.14",
  "evidence_refs": [],
  "execution_status": "executed",
  "id": "EV-117",
  "input_fingerprints": {
    "specs/001-piloto-real-confiavel/plan.md": "a069d7b1d149ba604d47c2cb8035b6bfe0e9dc7471acd4eb697cbcab209ab66e",
    "specs/001-piloto-real-confiavel/spec.md": "057aed7c1e1360d8f71167caca6af45c61c0ddf7114ce1d2eb8ce7d6dd5858ba",
    "src/sales_agent/privacy.py": "fa5cd43fc3f646f6fe8d577f180f59e1f8c02df5d1e6666f2ca3b2cb59ff4c88",
    "tests/test_privacy.py": "23867fe96660c21d26cb33884617a5ebcedea80e006a8de9404bcc00bfb43979"
  },
  "input_paths": [
    "src/sales_agent/privacy.py",
    "tests/test_privacy.py",
    "specs/001-piloto-real-confiavel/spec.md",
    "specs/001-piloto-real-confiavel/plan.md"
  ],
  "limitations": "",
  "observations": "5 privacy tests and final full regression 238 tests passed",
  "procedure": "python3.12 -m pytest -q tests/test_privacy.py",
  "result": "passed",
  "tested_revision": "local:b170b0330a352eda9f501fe952426f6426fc1c3e5a97edb55dd433e6b976565b",
  "ticket": "TK-014",
  "timestamp": "2026-09-28T18:30:02+00:00"
}
