{
  "acceptance_refs": [
    "AC-023"
  ],
  "environment": "OS=Linux-5.14.0-687.36.1.el9_8.x86_64-x86_64-with-glibc2.34; Python=3.9.25",
  "evidence_refs": [],
  "execution_status": "executed",
  "id": "EV-063",
  "input_fingerprints": {
    "specs/001-piloto-real-confiavel/plan.md": "a069d7b1d149ba604d47c2cb8035b6bfe0e9dc7471acd4eb697cbcab209ab66e",
    "specs/001-piloto-real-confiavel/spec.md": "057aed7c1e1360d8f71167caca6af45c61c0ddf7114ce1d2eb8ce7d6dd5858ba",
    "src/sales_agent/cli.py": "52f324b716564757fa959bf60a2d9a601b3eacfbeff3740dcd92bbd4ff091ead",
    "src/sales_agent/conversation.py": "1c5c88588cdd1e07f89e7dfed202834d259f9beffadc5cb81d97ba1eb81151ae",
    "src/sales_agent/model.py": "9915f54824aa259ab36377ad71e8cc2dbc3f71d766c039df521edf0036d16b4f",
    "tests/test_model_adapter.py": "1a85545fa8a2f718410c0ebc641693cc3537c0fb411c74484fc164e9eaf5a09c"
  },
  "input_paths": [
    "src/sales_agent/model.py",
    "src/sales_agent/conversation.py",
    "src/sales_agent/cli.py",
    "tests/test_model_adapter.py",
    "specs/001-piloto-real-confiavel/spec.md",
    "specs/001-piloto-real-confiavel/plan.md"
  ],
  "limitations": "Local fake HTTP only; real OpenAI call not run Evidence invalidated because an input changed.",
  "observations": "Both OpenAI and compatible profiles passed local HTTP contract with model/profile metadata; no real API call.",
  "procedure": ".venv/bin/python -m pytest -q tests/test_model_adapter.py",
  "result": "stale",
  "tested_revision": "local:abe6e9a2f2d85eb6329df42355ebfe81a3873b6c480c8624a3612c1fd99f0913",
  "ticket": "TK-008",
  "timestamp": "2026-09-28T15:50:49+00:00"
}
