{
  "acceptance_refs": [
    "AC-015"
  ],
  "environment": "OS=Linux-5.14.0-687.36.1.el9_8.x86_64-x86_64-with-glibc2.34; Python=3.9.25",
  "evidence_refs": [],
  "execution_status": "executed",
  "id": "EV-032",
  "input_fingerprints": {
    "specs/001-piloto-real-confiavel/plan.md": "a069d7b1d149ba604d47c2cb8035b6bfe0e9dc7471acd4eb697cbcab209ab66e",
    "specs/001-piloto-real-confiavel/spec.md": "057aed7c1e1360d8f71167caca6af45c61c0ddf7114ce1d2eb8ce7d6dd5858ba",
    "src/sales_agent/channel.py": "93d4b289564953d9faffe1731df01b2d70117dc12652b52581a7f5ead903fdd1",
    "src/sales_agent/conversation.py": "a55cad4956d46ab98439f75607848fec7692450fb2f93c686d9da3f36243cd03",
    "src/sales_agent/delivery.py": "3be45fc2cdc6b7056263ea7e505d3365c31a1e3aa8f79a742330d9ade52df135",
    "src/sales_agent/storage.py": "68ce1d1d41c7a39df0d3a31705685f8351674aacc12659165890e8642297b74c",
    "tests/test_channel_window.py": "99a1b0a9c91b72038ad1594c4ee5fd0993b1e461344ea63406eff1778c3a7d28"
  },
  "input_paths": [
    "src/sales_agent/channel.py",
    "src/sales_agent/conversation.py",
    "src/sales_agent/delivery.py",
    "src/sales_agent/storage.py",
    "tests/test_channel_window.py",
    "specs/001-piloto-real-confiavel/spec.md",
    "specs/001-piloto-real-confiavel/plan.md"
  ],
  "limitations": "Evidence invalidated because an input changed.",
  "observations": "A scheduled Chatwoot follow-up after the WhatsApp window ended was window_closed at delivery and revalidation returned reason window_closed.",
  "procedure": ".venv/bin/python -m pytest -q tests/test_channel_window.py tests/test_delivery_and_governance.py",
  "result": "stale",
  "tested_revision": "local:dfe90dfa54285cecf80ecbc78b8da51d34437127e9b05368cf2600877d8b2412",
  "ticket": "TK-006",
  "timestamp": "2026-09-28T15:17:24+00:00"
}
