{
  "acceptance_refs": [
    "AC-003"
  ],
  "environment": "OS=Linux-5.14.0-687.36.1.el9_8.x86_64-x86_64-with-glibc2.34; Python=3.12.14",
  "evidence_refs": [],
  "execution_status": "executed",
  "id": "EV-004",
  "input_fingerprints": {
    "docs/INSTALLATION.md": "69878f47f3448ea87c7d89cb4976186c6f55dc07a31ddfe41e4900b18f9be448",
    "pyproject.toml": "650cf8b8b45cf93db83308909c6499f2d9a1da2e7dc4cd3da8d44f140b7a8ae7",
    "specs/001-piloto-real-confiavel/plan.md": "a069d7b1d149ba604d47c2cb8035b6bfe0e9dc7471acd4eb697cbcab209ab66e",
    "specs/001-piloto-real-confiavel/spec.md": "057aed7c1e1360d8f71167caca6af45c61c0ddf7114ce1d2eb8ce7d6dd5858ba"
  },
  "input_paths": [
    "pyproject.toml",
    "docs/INSTALLATION.md",
    "specs/001-piloto-real-confiavel/spec.md",
    "specs/001-piloto-real-confiavel/plan.md"
  ],
  "limitations": "GitHub Actions workflow not executed; goal prohibits git push",
  "observations": "pip 3.10.21 rejects Python>=3.11; 3.11.16 and 3.14.7 each pass 172 tests; build and twine pass",
  "procedure": "/tmp/vendedor-py310/bin/python -m pip install --dry-run --no-deps .; /tmp/vendedor-py311/bin/python -m pytest -q; /tmp/vendedor-py314/bin/python -m pytest -q; .venv/bin/python -m build; .venv/bin/twine check dist/*",
  "result": "partial",
  "tested_revision": "local:df58e5cc38d8baacb60fb79205a92362f491d9600b26d44a81e907b0cf92f6b3",
  "ticket": "TK-002",
  "timestamp": "2026-09-28T14:19:56+00:00"
}
