{
  "acceptance_refs": [
    "AC-008"
  ],
  "environment": "OS=Linux-5.14.0-687.36.1.el9_8.x86_64-x86_64-with-glibc2.34; Python=3.12.14",
  "evidence_refs": [],
  "execution_status": "executed",
  "id": "EV-009",
  "input_fingerprints": {
    "specs/001-piloto-real-confiavel/plan.md": "a069d7b1d149ba604d47c2cb8035b6bfe0e9dc7471acd4eb697cbcab209ab66e",
    "specs/001-piloto-real-confiavel/spec.md": "057aed7c1e1360d8f71167caca6af45c61c0ddf7114ce1d2eb8ce7d6dd5858ba",
    "src/sales_agent/channel.py": "18e261aaed48d8c2fdd68b5398028529147431595c8cc3bca1eb3f88e568c40a",
    "tests/test_chatwoot_contract.py": "a7408d8dfc744f7bdb9bb94e62b6899035f384e9dfc145da72c0e27ed1905ca2"
  },
  "input_paths": [
    "src/sales_agent/channel.py",
    "tests/test_chatwoot_contract.py",
    "specs/001-piloto-real-confiavel/spec.md",
    "specs/001-piloto-real-confiavel/plan.md"
  ],
  "limitations": "Evidence invalidated because an input changed.",
  "observations": "Unknown outgoing message 99 from user with different content returned human_message and human_paused; 37 tests passed",
  "procedure": ".venv/bin/python -m pytest -q tests/test_chatwoot_contract.py tests/test_conversation_contract.py",
  "result": "stale",
  "tested_revision": "local:83e38f1e08e3d1ff07ce2282f7bca841449a3f63adedf1b28114bef7a5d47641",
  "ticket": "TK-004",
  "timestamp": "2026-09-28T14:41:40+00:00"
}
